{"artifacts":[{"path":"collection.json","sha256":"d51e969560a8d7e2e37498ecc7142621fb91d53f5b50015fc80035722aa99c2a"},{"path":"opportunities.json","sha256":"c2a50e36b932379b1257d5187e8a747d8396f1213c5075cfc943347db3071db8"}],"certification":{"errors":[],"state":"certified","warnings":[]},"collection_id":"collection-v1-384a076a1e7cc620e3348fc4","collection_sha256":"d51e969560a8d7e2e37498ecc7142621fb91d53f5b50015fc80035722aa99c2a","dataset_sha256":"c2a50e36b932379b1257d5187e8a747d8396f1213c5075cfc943347db3071db8","identity_seed_sha256":"60ecdb595ac1d38d5d3fe866c554aad51ea08ce576da1d5bd90871649c974444","opportunity_count":290,"query_config_sha256":"4faa7ad7022cc19b58c29611750c9ea73e238ec0940c46301bd173b3d2ebc37e","reference_time":"2026-09-28T19:17:03","schema":"snapshot.v1","schema_versions":["collection.v1","contribution-state.v1","execution-result.v1","opportunity.v1","radar-machine-feed.v1","snapshot.v1","verified-contribution-outcomes.v1"],"scoring_config_sha256":"b25a84aee1d814cc831f69399cf6b2c9f686c101404c736b431e3456c8d00c65","scoring_version":"radar-scoring-v1","snapshot_id":"snapshot-v1-c773bd1b54484eddfb6bad00","source_revision":"4af85a2bf51f7c84e28c1f4a5856d45703940f04","version":1}
