{"artifacts":[{"path":"collection.json","sha256":"a64249f720368494504af2d52f3c3e9e615ac9b35f503295bd4f5760f33691ff"},{"path":"opportunities.json","sha256":"7f57c735fa7851dcef10f7ecb291fe1ec64363f2dc423681a2424f45d2dfa2ad"}],"certification":{"errors":[],"state":"certified","warnings":[]},"collection_id":"collection-v1-bd23491816a0088de7c6dda2","collection_sha256":"a64249f720368494504af2d52f3c3e9e615ac9b35f503295bd4f5760f33691ff","dataset_sha256":"7f57c735fa7851dcef10f7ecb291fe1ec64363f2dc423681a2424f45d2dfa2ad","identity_seed_sha256":"e7c65119b73d465c9684061d628de6dfec3b9ca774e29464f7516a7b0e1f2bdc","opportunity_count":290,"query_config_sha256":"4faa7ad7022cc19b58c29611750c9ea73e238ec0940c46301bd173b3d2ebc37e","reference_time":"2026-09-27T19:13:37","schema":"snapshot.v1","schema_versions":["collection.v1","execution-result.v1","opportunity.v1","snapshot.v1"],"scoring_config_sha256":"b25a84aee1d814cc831f69399cf6b2c9f686c101404c736b431e3456c8d00c65","scoring_version":"radar-scoring-v1","snapshot_id":"snapshot-v1-787154c27ca635f5d632950c","source_revision":"efeba671672f3cd45e6dcacb4ac40222d64f9fbe","version":1}
